<?xml version="1.0" encoding="UTF-8"?>
<archivio xmlns:xs="http://www.w3.org/2001/XMLSchema-instance" xs:noNamespaceSchemaLocation="Cineteca.xsd">
	<!-- PELLICOLE -->
	
	<film>
		<pellicola>
			<regia>Regia 1</regia>
			<titolo>Titolo 1</titolo>
			<buonoStato>si</buonoStato>
			<tipologia>16mm</tipologia>
		</pellicola>
	</film>
	
	<film>
		<pellicola>
			<regia>Regia 2</regia>
			<titolo>Titolo 2</titolo>
			<buonoStato>si</buonoStato>
			<tipologia>16mm</tipologia>
		</pellicola>
	</film>
	
	<film>
		<pellicola>
			<regia>Regia 3</regia>
			<titolo>Titolo 3</titolo>
			<buonoStato>no</buonoStato>
			<tipologia>16mm</tipologia>
		</pellicola>
	</film>
	
	<film>
		<pellicola>
			<regia>Regia 4</regia>
			<titolo>Titolo 4</titolo>
			<buonoStato>si</buonoStato>
			<tipologia>35mm</tipologia>
		</pellicola>
	</film>
	
	
	<!-- AUDIOVISIVI -->
	<film>
		<audiovisivo>
			<nome>Nome 1</nome>
			<cognome>Cognome 1</cognome>
			<titolo>Titolo 5</titolo>
			<nazione>Italia</nazione>
			<lingua>Italiano</lingua>
			<colore>Colore</colore>
			<durata>1000</durata>
			<tipologia>Documentario</tipologia>
			<formato>Blu-ray</formato>
			<annoProduzione>2001</annoProduzione>
			<disponibilita>si</disponibilita>
			<collocazione>05.02.20.053.BIB</collocazione>
		</audiovisivo>
	</film>
	
	<film>
		<audiovisivo>
			<nome>Nome 2</nome>
			<cognome>Cognome 2</cognome>
			<titolo>Titolo 6</titolo>
			<nazione>Italia</nazione>
			<lingua>Italiano</lingua>
			<colore>BN</colore>
			<durata>1000</durata>
			<tipologia>Documentario</tipologia>
			<formato>Blu-ray</formato>
			<annoProduzione>2001</annoProduzione>
			<disponibilita>si</disponibilita>
			<collocazione>06.02.20.053.BIB</collocazione>
		</audiovisivo>
	</film>
	
	<film>
		<audiovisivo>
			<nome>Nome 1</nome>
			<cognome>Cognome 1</cognome>
			<titolo>Titolo 6</titolo>
			<nazione>Italia</nazione>
			<lingua>Italiano</lingua>
			<colore>BN</colore>
			<durata>1000</durata>
			<tipologia>Documentario</tipologia>
			<formato>Blu-ray</formato>
			<annoProduzione>2001</annoProduzione>
			<disponibilita>no</disponibilita>
			<collocazione>07.02.20.053.BIB</collocazione>
		</audiovisivo>
	</film>
</archivio>























